{"entry_id": 0, "timestamp": "2026-10-21T10:03:00Z", "run_id": "mock-drift-001", "prev_hash": "GENESIS", "hash": "REPLACE_WITH_SHA256", "twin_version": "twin-0.1", "twin_confidence": 0.46, "evidence_refs": ["ev-001", "ev-002"], "agents_used": ["health_agent"], "tools_used": ["get_residual_summary"], "finding": {"label": "inconclusive", "confirmed_observations": ["voltage residual rising since t=150s"], "possible_explanations": ["sensor drift", "battery degradation"], "insufficient_evidence": true}, "recommendation": {"text": "Recalibrate the voltage sensor and rerun the baseline.", "uncertainty": "high"}, "human_approval": null, "test_outcome": null, "gate_result": "inconclusive", "gate_reasons": ["twin confidence below threshold"]}
